,Unnamed: 0,country,description,designation,points,price,province,region_1,region_2,taster_name,taster_twitter_handle,title,variety,winery
26038,26038,Spain,"Raw, gamy aromas of herbal black fruits and wet dog fur set up a bumpy palate that's tough and jagged. Unabsorbed oak sits atop rudimentary berry fruit flavors, while the finish is choppy, oaky and herbal.",Finca Resalso,84,15.0,Northern Spain,Ribera del Duero,,Michael Schachner,@wineschach,Emilio Moro 2015 Finca Resalso  (Ribera del Duero),Tempranillo,Emilio Moro
115439,115439,US,"This wine is mild in acidity and simple in structure, a light-bodied take on the variety that shows flavors of green apple and green olive tapenade.",,87,24.0,California,Napa Valley,Napa,Virginie Boone,@vboone,Rutherford Ranch 2015 Chardonnay (Napa Valley),Chardonnay,Rutherford Ranch
111361,111361,Austria,"This is described as Brut dry, but the perfumed character of the Gelber Muskateller grape gives this fruity wine a feeling of sweetness. It's soft, aromatic and lightly flavored with lychee.",Sparkling Mosi Brut,85,,Österreichischer Sekt,,,Roger Voss,@vossroger,Hermann Moser NV Sparkling Mosi Brut Gelber Muskateller (Österreichischer Sekt),Gelber Muskateller,Hermann Moser
109611,109611,France,"This big, ripe wine is opulent and smooth. With layers of rich lychee and mango fruit flavors, along with spiced pears, this is a delicious, ready-to-drink wine. It's generous to a fault, a great wine to drink with pâtés and spiced food.",Tradition,87,27.0,Alsace,Alsace,,Roger Voss,@vossroger,Domaine Schoffit 2012 Tradition Pinot Gris (Alsace),Pinot Gris,Domaine Schoffit
33921,33921,US,"The wine has tempting aromas like marzipan and pineapple, generous fruit flavors and just enough acidity for balance. It's medium-bodied and feels bright and flavorful in the mouth.",,86,12.0,California,California,California Other,Jim Gordon,@gordone_cellars,Leese-Fitch 2014 Chardonnay (California),Chardonnay,Leese-Fitch
5184,5184,Italy,"Rich in wild cherry, raspberry, black cherry and white pepper, this delicious wine offers all the juicy fruit, freshness, minerality and supple tannins that make a young, well-made Morellino so attractive. Extremely enjoyable now, it will maintain beautifully until 2017–2018 and develop more depth.",,90,19.0,Tuscany,Morellino di Scansano,,Kerin O’Keefe,@kerinokeefe,Terenzi 2012  Morellino di Scansano,Sangiovese,Terenzi
125151,125151,France,"One of the many labels owned by the Grassa family of Domaine du Tariquet, this is so light and fresh that it just floats across the palate. It is citrus-crisp, with a tight apple skin texture. Great for apéritifs. Screwcap.",,86,10.0,Southwest France,Vin de Pays des Côtes de Gascogne,,Roger Voss,@vossroger,Domaine de Pouy 2008 White (Vin de Pays des Côtes de Gascogne),White Blend,Domaine de Pouy
73127,73127,Italy,"Underbrush, blackberry, blue flower and mocha lead the nose on this blend of Sangiovese, Cabernet Sauvignon and Syrah. The dense palate offers cassis, black cherry, black pepper, espresso and licorice alongside youthfully assertive tannins. Drink 2016–2021.",Riserva,90,33.0,Tuscany,Morellino di Scansano,,Kerin O’Keefe,@kerinokeefe,Morisfarms 2011 Riserva  (Morellino di Scansano),Red Blend,Morisfarms
114657,114657,Austria,"Clean, tight and crisp, this treads a straight, citrusy path seamed by a phenolic touch and the aroma of crisp, green pears.",Austrian Pepper,88,14.0,Niederösterreich,,,Anne Krebiehl MW,@AnneInVino,R&A; Pfaffl 2013 Austrian Pepper Grüner Veltliner (Niederösterreich),Grüner Veltliner,R&A; Pfaffl
118896,118896,US,"The mocha, toasted oak and sugared violet scents are lovely. There's a fairly good core of black fruit and creamy mocha on the palate as well, but green leaves and tomato peek through the midpalate, accompanied by some gripping grape tannins. The finish is marked by tart sour cherry and some floral notes.",Long-Bomb Edition Two,84,25.0,Virginia,Virginia,,Anna Lee C. Iijima,,Tarara 2008 Long-Bomb Edition Two Red (Virginia),Red Blend,Tarara
46156,46156,US,"Paix Sur Terre manages to translate the heat and sunshine of Paso Robles into a rich and savory but not overripe wine. Quite dark in the glass, it shows blackberry, black plum, roast beef, black pepper and soy notes on the nose. The palate is dense and creamy, with dark chocolate, roasted blackberry, vanilla and caramel flavors.",The Other One Glenrose Vineyard,94,52.0,California,Adelaida District,Central Coast,Matt Kettmann,@mattkettmann,Paix Sur Terre 2015 The Other One Glenrose Vineyard Mourvèdre (Adelaida District),Mourvèdre,Paix Sur Terre
113595,113595,France,"A tight wine with notes of almond and green fruit that add tension to the structure. The acidity is dominant in this complex, textured wine. It could age beautifully over the next 2–3 years.",Saphir Brut Vintage,89,15.0,Loire Valley,Saumur,,Roger Voss,@vossroger,Bouvet-Ladubay 2010 Saphir Brut Vintage  (Saumur),Chenin Blanc-Chardonnay,Bouvet-Ladubay
53593,53593,Portugal,"A smooth, ripe, juicy wine, with vanilla flavors from wood aging and fresh berry fruits as companions. The wine is soft, gently tannic and ready to drink.",Vale de Lobos,85,,Tejo,,,Roger Voss,@vossroger,Quinta da Ribeirinha 2013 Vale de Lobos Red (Tejo),Portuguese Red,Quinta da Ribeirinha
37418,37418,Spain,"Gritty tarry slightly gaseous aromas of jammy black fruits are a bit less than precise. This feels flush but soft around the edges. Blackened berry and black-plum flavors are lightly charred and chocolaty, while this tastes of black pepper and shows some heat on the finish. Drink through 2022.",Elite,90,33.0,Northern Spain,Ribera del Duero,,Michael Schachner,@wineschach,Pradorey 2010 Elite  (Ribera del Duero),Tinta Fina,Pradorey
16789,16789,France,"With attractive mint aromas, this polished wine balances structure and fruit. New wood shows through but it doesn't dominate the black fruits that give weight and ripeness. It shows the typical juiciness of the vintage. Drink from 2017.",,89,20.0,Bordeaux,Castillon Côtes de Bordeaux,,Roger Voss,@vossroger,Château Moya 2011  Castillon Côtes de Bordeaux,Bordeaux-style Red Blend,Château Moya
38782,38782,Spain,"Rubbery berry aromas are a touch herbal, gaseous and briny. A combination of choppy tannins and high acidity make for a jumpy mouthfeel, while acid-propelled flavors of plum and raspberry are fiery and long. Drink this organic blend of Garnacha Tintorera, Monastrell and Syrah through 2019.",Crux Càsa Benasal,89,25.0,Levante,Valencia,,Michael Schachner,@wineschach,Pago Casa Gran 2010 Crux Càsa Benasal Red (Valencia),Red Blend,Pago Casa Gran
68458,68458,Israel,"With a nose of cherry and smoked meats, this wine offers flavors of black plum, blackberry, cranberry and a touch of summer farm stand. Healthy tannins compensate for a sense of tartness by adding weight and volume to the palate.",Reserve,90,45.0,Galilee,,,Mike DeSimone,@worldwineguys,Flam 2014 Reserve Syrah (Galilee),Syrah,Flam
77949,77949,US,"A whisper of a wine made from Chardonnay grapes as a pétillant naturel, or pet-nat, this third vintage of Lily's Cuvée should prove as enormously popular as the prior two, dry, delicious and unbearably light. No sugar or yeast are added and the grapes are whole-cluster pressed. There's no better wine for midday picnics or hikes in the woods.",Lily's Cuvée,90,30.0,California,Anderson Valley,,Virginie Boone,@vboone,Donkey & Goat 2013 Lily's Cuvée Chardonnay (Anderson Valley),Chardonnay,Donkey & Goat
30048,30048,Argentina,"This smells mildly reduced and candied at first, with notes of blackberry, horse hide and licorice. Firm, chewy and lush on the palate, this full-force Malbec delivers ripe blackberry, boysenberry, spice and rooty licorice flavors prior to a spicy, dark finish that's bolstered by firm acidity. Drink through 2019.",Gran Reserva,90,30.0,Mendoza Province,Mendoza,,Michael Schachner,@wineschach,Larrea 2010 Gran Reserva Malbec (Mendoza),Malbec,Larrea
102163,102163,US,"Pressed plum and dried berry meet with leather on the nose, becoming a bit musty over time. The dusty flavors carry to the sip, where underripe bramble provides tang but little else.",,84,19.0,California,Central Coast,Central Coast,Matt Kettmann,@mattkettmann,Unparalleled 2014 Cabernet Sauvignon (Central Coast),Cabernet Sauvignon,Unparalleled
28702,28702,France,"Pale in color, this is a light, bright style of rosé. It is clean and crisp, with touches of red fruit that float through the attractive fresh acidity. The aftertaste is fleeting and refreshing.",L'Instant,87,18.0,Provence,Côtes de Provence,,Roger Voss,@vossroger,Château Barbanau 2015 L'Instant Rosé (Côtes de Provence),Rosé,Château Barbanau
108702,108702,France,"This impressive Champagne is rich while tight and mineral-textured. Creamy and ripe, it balances the weight of Pinot Noir with the elegance of Chardonnay. The producer's location in the relatively warm Aube region gives its wines extra fullness. This one is just now ready to drink.",Cuvée Symbiose Brut,92,40.0,Champagne,Champagne,,Roger Voss,@vossroger,Fluteau 2008 Cuvée Symbiose Brut  (Champagne),Champagne Blend,Fluteau
27968,27968,US,"Complemented by 9% Sémillon, this concentrated, creamy young wine is generous in pear, peach and subtle pineapple. Tart, it remains fresh and focused in the glass, with a lushness that's memorable and compelling. An impactful finish wraps things up nicely.",,91,21.0,California,Napa Valley,Napa,Virginie Boone,@vboone,Groth 2014 Sauvignon Blanc (Napa Valley),Sauvignon Blanc,Groth
82608,82608,Italy,"Made entirely with Merlot, the shy nose eventually reveals notes of black-skinned fruit and clove. The dense palate delivers cedar, espresso and leather alongside gripping tannins.",La Historia di Italia,88,38.0,Tuscany,Toscana,,Kerin O’Keefe,@kerinokeefe,Conte Ferdinando Guicciardini 2013 La Historia di Italia Merlot (Toscana),Merlot,Conte Ferdinando Guicciardini
78905,78905,US,"A pretty shade of pale pink, this dry and spicy rosé has a boisterous personality. Its watermelon and strawberry flavors come with a kick, showing real depth. Juicy acidity keeps it fresh and forward.",Rosé of,90,28.0,Oregon,Willamette Valley,Willamette Valley,Paul Gregutt,@paulgwine ,Elizabeth Chambers 2016 Rosé of Pinot Noir (Willamette Valley),Pinot Noir,Elizabeth Chambers
114084,114084,US,"A very dry and firmly tannic wine, this doesn't give up much aroma, and the flavors also seem bound up with the astringent texture. With a bit of time some blueberry and blackberry aromas emerge, and flavors of black olive, too. This wine seems to require the most marbled steak to balance its austerity in texture, or perhaps 10 years in a cool cellar.",Black,85,75.0,California,Suisun Valley,North Coast,Jim Gordon,@gordone_cellars,Vellum 2012 Black Petit Verdot (Suisun Valley),Petit Verdot,Vellum
114611,114611,South Africa,"Sweet accents of vanilla bean and cedar spice up the red plum and raspberry core of this wine. Creamy and round in the mouth with soft tannins and a medium-length finish, this is a wine that's easy to enjoy now.",,87,11.0,Western Cape,,,Lauren Buzzeo,@laurbuzz,La Capra Presented by Fairview 2010 Pinotage (Western Cape),Pinotage,La Capra Presented by Fairview
92228,92228,France,"This is well-balanced and ripe, with plenty of room for both the attractive black fruits and the firm tannic structure. Wood aging shows, although it will integrate well. The wine is fruity, likely to be ready to drink from 2016.",Château Courbian,87,19.0,Bordeaux,Médoc,,Roger Voss,@vossroger,Producta Vignobles 2011 Château Courbian  (Médoc),Bordeaux-style Red Blend,Producta Vignobles
101058,101058,France,This is a fresh wine that also has a strong sense of structure. It's textured with white fruits coming through a nervy acidity and minerality. Hints of wood are tantalizing and round the wine out at the end.,Emile Beranger,89,,Burgundy,Pouilly-Fuissé,,Roger Voss,@vossroger,Georges Duboeuf 2011 Emile Beranger  (Pouilly-Fuissé),Chardonnay,Georges Duboeuf
25328,25328,Italy,"This attractive Brunello presents a wild, brambly side, with aromas of wild mushroom, forest floor, small berry and crème de cassis. It boasts a beautiful, deep color and plenty of concentration, with endnotes of spice, leather and dried tobacco leaf. The mouthfeel is solid, well defined and superbly structured.",Val di Suga,95,61.0,Tuscany,Brunello di Montalcino,,,,Tenimenti Angelini 2007 Val di Suga  (Brunello di Montalcino),Sangiovese Grosso,Tenimenti Angelini
88439,88439,US,"This is the winery's first commercial release of this varietal, all aged in neutral French oak. It offers nuanced aromas of spice, tobacco, vanilla and savory notes that are followed by plentiful, palate-coating red and blue-fruit flavors that extend out through a long, fruit and spice-filled finish. Firm tannins provide the structure. It needs time still but possesses a delicious factor that is impossible to ignore.",Stone Tree,93,28.0,Washington,Wahluke Slope,Columbia Valley,Sean P. Sullivan,@wawinereport,Waters 2012 Stone Tree Tempranillo (Wahluke Slope),Tempranillo,Waters
21135,21135,Chile,"Nectarine, apricot and botrytis aromas are sound but familiar. Round, full but not quite sticky, this tastes like toffee, honey and pear, with baking spice flavors, nutmeg in particular, on the finish.",Toro de Piedra Grand Reserve Late Harvest,88,12.0,Curicó Valley,,,Michael Schachner,@wineschach,Viña Requingua 2013 Toro de Piedra Grand Reserve Late Harvest Sauvignon Blanc-Semillon (Curicó Valley),Sauvignon Blanc-Semillon,Viña Requingua
13991,13991,US,"Estate grown from an historic vineyard planted by the producer's father, this wine is velvety smooth and decked in chocolate, densely rich and delicious in caramel and blackberry pie. Enjoyable now, it has the legs and structure to age through 2025–2030.",Aldo's Vineyard,93,78.0,California,Oak Knoll District,Napa,Virginie Boone,@vboone,Robert Biale 2013 Aldo's Vineyard Zinfandel (Oak Knoll District),Zinfandel,Robert Biale
94042,94042,Italy,"Packaged in an extremely heavy bottle, this opulent Amarone delivers knockout aromas of toasted almond, hickory smoke, pipe tobacco and spice. Fruit flavors of plum, prune and blackberry are followed by a much-needed touch of acidity that keeps the palate refreshed.",Tenuta Valleselle Aurum,90,25.0,Veneto,Amarone della Valpolicella Classico,,,,Tinazzi 2008 Tenuta Valleselle Aurum  (Amarone della Valpolicella Classico),"Corvina, Rondinella, Molinara",Tinazzi
98154,98154,Italy,"Subdued aromas of ripe dark-skinned berry, espresso and tobacco lead the nose while the soft, dense palate offers fleshy black cherry, blackberry extract, coffee and a hint of ground cooking spice. It's ripe and ready so enjoy soon.",Contado Riserva,88,18.0,Southern Italy,Molise,,Kerin O’Keefe,@kerinokeefe,Di Majo Norante 2012 Contado Riserva Aglianico (Molise),Aglianico,Di Majo Norante
40698,40698,US,"Marked by ripe flavors of raspberry and cherry jam, blueberry pie with the crust and black pepper, this Zin's fruit is the star. It's a little on the soft, direct side, but sure is delicious. Drink now.",Bacigalupi Vineyards,87,38.0,California,Russian River Valley,Sonoma,,,Graton Ridge 2009 Bacigalupi Vineyards Zinfandel (Russian River Valley),Zinfandel,Graton Ridge
7206,7206,US,"A whiff of pine needle runs through this wine, accenting its tight and trim red berry fruit. It's a mix of three clones that were aged in one quarter new French oak, which brings notes of vanilla and toast to its smooth finish.",Croft Vineyard,90,45.0,Oregon,Willamette Valley,Willamette Valley,Paul Gregutt,@paulgwine ,Fullerton 2015 Croft Vineyard Pinot Noir (Willamette Valley),Pinot Noir,Fullerton
26227,26227,Turkey,"Aromas of grapefruit, orange peel and freshly starched sheets give way to flavors of lemon curd, grapefruit, hazelnut and rose petal in this wine made of 100% Emir, a native Turkish variety. There is a sense of brightness on the palate, and the soft floral finish features a final spray of citrus.",,88,15.0,Turkey,,,Mike DeSimone,@worldwineguys,Turasan 2013 Emir (Turkey),Emir,Turasan
18836,18836,US,"Though two years older than the widely available Oregon bottling from Firesteed, this wine is almost its twin. Elegant and balanced, with light flavors of wild berry and an herbal underpinning.",,87,30.0,Oregon,Willamette Valley,Willamette Valley,Paul Gregutt,@paulgwine ,Firesteed 2007 Pinot Noir (Willamette Valley),Pinot Noir,Firesteed
56182,56182,Argentina,"With acrid matchstick aromas and little else, this wine gets off to a rough start and never finds solid footing. The palate is chunky and grabby, while the flavors are burnt and stalky, with bitterness to the finish.",Premium Series,81,18.0,Mendoza Province,Mendoza,,Michael Schachner,@wineschach,Solo Contigo 2011 Premium Series Sauvignon Blanc (Mendoza),Sauvignon Blanc,Solo Contigo
84428,84428,Italy,"Aromas of wild herb, citrus, flint and orchard fruit lead the nose on this polished white. The bright palate offers up Bosc pear, sage, energizing mineral and a note of lemon zest. It's well balanced, with crisp acidity.",Praepositus,90,25.0,Northeastern Italy,Alto Adige Valle Isarco,,Kerin O’Keefe,@kerinokeefe,Abbazia di Novacella 2014 Praepositus Sylvaner (Alto Adige Valle Isarco),Sylvaner,Abbazia di Novacella
21673,21673,Italy,"A 50-50 blend of Sangiovese and Malvasia Nera, Maurleo shows a fresh, crisp quality with red cherry and wild berries in the foreground. Dig deeper and you'll find spice, toast and nutty tones as well.",Maurleo,88,18.0,Tuscany,Toscana,,,,Pietro Beconcini 2006 Maurleo Red (Toscana),Red Blend,Pietro Beconcini
1554,1554,US,"Aged entirely in neutral French oak, this wine takes a light, simplistic approach in its presentation of golden honey apple and pear flavor.",,85,28.0,California,Russian River Valley,Sonoma,Virginie Boone,@vboone,Bowman Cellars 2015 Chardonnay (Russian River Valley),Chardonnay,Bowman Cellars
28216,28216,US,"A nice everyday Chard, fairly rich in fruit, herb and spice flavors, and with a nice overlay of oak. Easy to drink and totally dry.",Handley Vineyard,85,20.0,California,Dry Creek Valley,Sonoma,,,Handley 2006 Handley Vineyard Chardonnay (Dry Creek Valley),Chardonnay,Handley
99732,99732,Portugal,"From a small vineyard in the hills of the Lisbon region, this is a deliciously fresh and fruity wine. It has great acidity from the local Arinto grapes that are blended with Antão Vaz and Viosinho. Grapefruit and a crisp, zesty texture are refreshing and lively. Drink now.",Vale da Mata Branco,89,21.0,Lisboa,,,Roger Voss,@vossroger,Herdade do Rocim 2014 Vale da Mata Branco White (Lisboa),Portuguese White,Herdade do Rocim
37068,37068,Australia,"A faint coppery-pink rosé, Taltarni's 2008 Taché is a blend of 58% Chardonnay, 37% Pinot Noir and 5% Pinot Meunier. It's lean and crisp, with a zesty, citrusy feel to the modest toast and mushroom flavors.",Taché,88,25.0,Australia Other,South Eastern Australia,,Joe Czerwinski,@JoeCz,Taltarni 2008 Taché Sparkling (South Eastern Australia),Sparkling Blend,Taltarni
117885,117885,US,"Hard tannins currently lock this wine down. Although it's astringent, it's very polished and complex. Made from Cabernet Franc, Merlot and Cabernet Sauvignon, in that order, it's marked by black cherry, red currant and cedar flavors, and finishes totally dry. The vineyard is in the cool Oak Knoll District, which helps explain the acidity and tightness. Difficult to predict if it will age.",Paramour,92,125.0,California,Napa Valley,Napa,,,Blackbird Vineyards 2009 Paramour Red (Napa Valley),Bordeaux-style Red Blend,Blackbird Vineyards
26795,26795,France,"This warm, rounded and ripe wine offers balanced fruit and acidity. A crisp edge to the rich pear and spicy flavor is lifted by an attractive touch of cinnamon. The final acidity is steely, bringing in a mineral element. Drink now.",Domaine Chataigneraie-Laborier Terroirs de Vergisson,90,32.0,Burgundy,Pouilly-Fuissé,,Roger Voss,@vossroger,Domaine Gilles Morat 2014 Domaine Chataigneraie-Laborier Terroirs de Vergisson  (Pouilly-Fuissé),Chardonnay,Domaine Gilles Morat
60241,60241,US,"From an organically farmed block planted entirely to the Pommard clone, this wine offers strawberry, earth and black tea, diluted slightly by a tannic underbite that competes with the fruit. Softly structured, it grips further on the finish.",Don Miguel Vineyard Earthquake Block,87,52.0,California,Russian River Valley,Sonoma,Virginie Boone,@vboone,Marimar Estate 2013 Don Miguel Vineyard Earthquake Block Pinot Noir (Russian River Valley),Pinot Noir,Marimar Estate
127877,127877,France,The wine is structured while also juicy. Its red-berry fruits are in the process of coming together with the tannins to give a rich wine. It has plenty of acidity at the end to give a crisp aftertaste.,Cuvée Alix,87,20.0,Bordeaux,Bordeaux Supérieur,,Roger Voss,@vossroger,Château Panchille 2015 Cuvée Alix  (Bordeaux Supérieur),Bordeaux-style Red Blend,Château Panchille
90,90,US,"This blend of Sangiovese, Malbec, Cabernet Sauvignon, Petite Sirah and other varieties plays well to type. It shows a wealth of ripe, dusty black fruit that's richly round and soft on the palate, approachable and lightly oaked.",Siena,88,23.0,California,Sonoma County,Sonoma,Virginie Boone,@vboone,Ferrari-Carano 2014 Siena Red (Sonoma County),Red Blend,Ferrari-Carano
102974,102974,US,"This is a bold and expressive but not overly big wine. It smells wonderfully like clove and coriander, and tastes generously focused on classic black cherry and cedar notes. It's full bodied, but has great acidity and a lively layer of tannins to keep it balanced and refreshing.",Azaya Ranch Vineyard,93,58.0,California,Marin County,North Coast,Jim Gordon,@gordone_cellars,Dutton-Goldfield 2013 Azaya Ranch Vineyard Pinot Noir (Marin County),Pinot Noir,Dutton-Goldfield
70213,70213,US,"This is an impressive effort, especially at the price, which is kind of unheard of in these parts. Softened by 9% Merlot, it's rich and full-bodied without ever overdoing it, opaque in color with a nose of baked bread and flavors of raspberry and black currant. It's food-ready.",,90,25.0,California,Napa Valley,Napa,Virginie Boone,@vboone,Buehler 2013 Cabernet Sauvignon (Napa Valley),Cabernet Sauvignon,Buehler
75990,75990,France,"This reasonably priced Hermitage shows the appellation's hallmark gamy notes. It's a sturdy, moderately full-bodied wine with a richly textured finish. Drink now–2025.",,89,50.0,Rhône Valley,Hermitage,,Joe Czerwinski,@JoeCz,Louis Bernard 2010  Hermitage,Syrah,Louis Bernard
22257,22257,France,This is the entry-level wine from this estate situated in the small area of Coteaux Varois. It is a really fruity blend of Grenache and Cinsault. Bright red fruits and crisp acidity give a dry wine with great fruitiness. Drink now.,,88,18.0,Provence,Coteaux Varois en Provence,,Roger Voss,@vossroger,Château d'Ollières 2016 Rosé (Coteaux Varois en Provence),Rosé,Château d'Ollières
28164,28164,France,"This dense and dark wine offers spice and toast flavors. It has a big, generous feel, leaving room both for the dry, still-young tannins and for aromatic blackberry fruits. It does need to age, so drink from 2017.",Tradition,90,16.0,Southwest France,Cahors,,Roger Voss,@vossroger,Château Eugénie 2012 Tradition Malbec-Merlot (Cahors),Malbec-Merlot,Château Eugénie
59446,59446,US,"An easy Chard, with good varietal character and a nice, dry finish. Crisp acids and a rich coating of oak enhance the modest pineapple, peach and pear flavors.",,85,15.0,California,Napa Valley,Napa,,,Beaulieu Vineyard 2006 Chardonnay (Napa Valley),Chardonnay,Beaulieu Vineyard
81675,81675,US,"This is one of the more interesting rosés of the vintage, in part because it is almost as hay-colored as a white wine and doesn't adhere to the standard pink profile. Aromas of crushed Marcona almonds, sea salt and oak smoke show on the nose, and the acid-driven palate continues that nutty and smokey drive. It's intriguing and unique, though not particularly pink.",,88,38.0,California,Paso Robles,Central Coast,Matt Kettmann,@mattkettmann,Daou 2016 Rosé (Paso Robles),Rosé,Daou
122247,122247,US,"The oak—a mixture of new and used French and American—takes the lead on this wine, with aromas and flavors of vanilla, cocoa and coffee out in front of plum and dark fruit. There's a pleasing mixture of richness and lightness. The variety gets a bit subsumed but there's still much to enjoy.",Stillwater Creek Vineyard,90,28.0,Washington,Columbia Valley (WA),Columbia Valley,Sean P. Sullivan,@wawinereport,Novelty Hill 2012 Stillwater Creek Vineyard Malbec (Columbia Valley (WA)),Malbec,Novelty Hill
103818,103818,US,"A sweet-smelling wine with notes of overripe pear, pineapple and jasmine. It also drinks quite sweet (26g/L residual sugar) but doesn't have the acid or flavor concentration to match.",,84,9.0,Washington,Washington,Washington Other,Sean P. Sullivan,@wawinereport,Paradise Peak 2012 Riesling (Washington),Riesling,Paradise Peak
123874,123874,France,"The blend of delightfully crisp wine is based around three years of reserve wines. It is creamy, with just a hint of toastiness. The acidity and ripe apple combine well with this touch of bottle age to give a wine that is ready to drink.",Blanc de Blancs Brut,91,37.0,Champagne,Champagne,,Roger Voss,@vossroger,Vollereaux NV Blanc de Blancs Brut Chardonnay (Champagne),Chardonnay,Vollereaux
