,Unnamed: 0,country,description,designation,points,price,province,region_1,region_2,taster_name,taster_twitter_handle,title,variety,winery
70485,70485,US,"The tartness in this wine veers slightly sour, with the acidity dialed perhaps a notch too high. Herb and salt intermix to give a more savory character, with a freshness to the finish.",Estate,84,30.0,California,Russian River Valley,Sonoma,Virginie Boone,@vboone,Uptick Vineyards 2011 Estate Chardonnay (Russian River Valley),Chardonnay,Uptick Vineyards
51466,51466,Brazil,"Stale fruit and damp-earth aromas are a warning sign. In the mouth, this Cabernet Sauvignon is raw and acidic, with hard tannins. Lean plum flavors are oaky and resiny, while this feels scratchy on an intensely dry finish.",Fração Única,83,28.0,Vale Trentino,,,Michael Schachner,@wineschach,Casa Perini 2014 Fração Única Cabernet Sauvignon (Vale Trentino),Cabernet Sauvignon,Casa Perini
56411,56411,France,"A touch of vanilla can be discerned in the sweet peachy juiciness of this wine which is already apparent on the nose. The palate is fluid, almost plump and rich with these flavors, especially peach and rose, come to the fore. A pleasantly bitter phenolic edge saves this from becoming too rich. Alcoholic warmth is apparent on the rich sweet finish.",Brand Grand Cru,91,30.0,Alsace,Alsace,,Anne Krebiehl MW,@AnneInVino,Dopff Au Moulin 2015 Brand Grand Cru Gewurztraminer (Alsace),Gewürztraminer,Dopff Au Moulin
15711,15711,US,"With no rough edges and quite a bit of silky appeal, this earns points for its dry elegance. The flavors are elusive: At first there is a fresh, ripe cherry note, then an olive tapenade element and a moment later a rich earthiness. It is fairly tannic, however, and unlikely to age for very long. Drink now–2014.",,88,30.0,California,Carneros,Napa-Sonoma,,,Truchard 2008 Merlot (Carneros),Merlot,Truchard
127917,127917,US,"Baked strawberry, stewed peppercorns and incense show on the peppery nose of this wine from veteran vintner Chuck Carlson's personal label. The flavors are darker than expected, with dried blueberry, boysenberry, beef char, cracked black pepper, tobacco and a touch of leather.",,89,30.0,California,Santa Ynez Valley,Central Coast,Matt Kettmann,@mattkettmann,Carlson 2012 Cabernet Franc (Santa Ynez Valley),Cabernet Franc,Carlson
46476,46476,Austria,Grapefruit peel and ripe Mirabelle plums are just hinted at on this sleek white. Thrilling acidity counters alcoholic warmth and give poise to the concentrated body. It still needs to open up more but promises pleasure.,Wösendorfer Hochrain Smaragd,92,80.0,Wachau,,,Anne Krebiehl MW,@AnneInVino,Rudi Pichler 2012 Wösendorfer Hochrain Smaragd Grüner Veltliner (Wachau),Grüner Veltliner,Rudi Pichler
32600,32600,Austria,"A combination of dried white currant, green apple and lemon makes for a refreshing, clean palate with a medium, zesty finish.",,87,16.0,Niederösterreich,,,Anne Krebiehl MW,@AnneInVino,Landhaus Mayer 2013 Riesling (Niederösterreich),Riesling,Landhaus Mayer
99198,99198,US,"Aromas of cassis, dried cranberry and black cherry are backed by tobacco and a kick of licorice. The palate is ripe in raspberry, blueberry and black cherry, showing whispers of leather and white pepper. The tannins add balance, mellowing some of the ripeness. Currant and vanilla show on the medium-length finish.",Private Reserve Double Barrel,88,30.0,Texas,Texas High Plains,,Fiona Adams,@bkfiona,Messina Hof 2015 Private Reserve Double Barrel Malbec (Texas High Plains),Malbec,Messina Hof
127049,127049,Argentina,"Medicinal cherry and plum aromas set up a palate with clipped, hard tannins. Forced flavors of oak and carob are more obvious than the wine's plum and cassis notes. Oak dominates the creamy, charred finish.",Estate,85,10.0,Mendoza Province,Mendoza,,Michael Schachner,@wineschach,Finca El Origen 2016 Estate Malbec (Mendoza),Malbec,Finca El Origen
82831,82831,France,"Still young but already impressive, this new vintage of Cristal Rosé is dry and perfumed, packed with fruit and tightened by acidity. It features red fruit, zesty blood orange and ripe apple flavors. Because it is young and because it is dry, the wine needs to age. Drink from 2019.",Cristal Rosé Brut,95,469.0,Champagne,Champagne,,Roger Voss,@vossroger,Louis Roederer 2009 Cristal Rosé Brut  (Champagne),Champagne Blend,Louis Roederer
41051,41051,Spain,"The immediate impression is that this wine is heavy, ripe and oaky. Sawdust and wood grain are the lead aromas. In the mouth, this chunky Priorat is hard, with grating tannins. Hickory and toasted berry flavors finish hot and resiny.",,89,95.0,Catalonia,Priorat,,Michael Schachner,@wineschach,Vall Llach 2009 Red (Priorat),Red Blend,Vall Llach
87271,87271,US,"This small-production Cab is at first faint in subtle fruit but slowly works its magic, offering balanced layers of black currant and blackberry around soft, toasty mocha oak, picking up nuance and complexity on the way to a lingering finish.",Neal 3 Vineyard,92,70.0,California,Napa Valley,Napa,Virginie Boone,@vboone,Mulvane Wine Co. 2011 Neal 3 Vineyard Cabernet Sauvignon (Napa Valley),Cabernet Sauvignon,Mulvane Wine Co.
47177,47177,Chile,"Briary, herbal berry aromas are dry, earthy, foresty and show a note of olive. This Cab is full of life on the palate, with energy and good overall balance. Spicy flavors of baked plum, olive, herbs and tobacco finish long, with amplified oak. Drink now through 2018.",Tributo Single Vineyard,90,20.0,Colchagua Valley,,,Michael Schachner,@wineschach,Caliterra 2013 Tributo Single Vineyard Cabernet Sauvignon (Colchagua Valley),Cabernet Sauvignon,Caliterra
89127,89127,Spain,"A little heavy and sweet on the nose, but juicy and deep on the palate, with round, pleasant lemon, grapefruit and green melon flavors. Dry, pure and driving white wine with a long, clean finish. Galician Godello in good form.",Alma de Blanco,88,15.0,Galicia,Monterrei,,Michael Schachner,@wineschach,Pazo das Tapias 2008 Alma de Blanco Godello (Monterrei),Godello,Pazo das Tapias
46760,46760,Italy,"Mazzei, the family behind Fonterutoli in Chianti, is the maker of this 100% Sangiovese, which offers a strong, piercing nose of earth, leather, red fruit and oak. If given time in the glass, the muscular palate loosens its stern grip, unveiling a nice underlay of plum, berries and oak. Far better than pedestrian, this is a sturdy, well-made Tuscan red.",,89,20.0,Tuscany,Morellino di Scansano,,Michael Schachner,@wineschach,Tenuta Belguardo 1999  Morellino di Scansano,Sangiovese,Tenuta Belguardo
112058,112058,Austria,"This wine's nose gives little more than a suggestion of zesty ripeness. The palate, on the other hand, is full of friendly, lively fruit. Crisp green and yellow apple and ripe citrus pervade its slender but joyful frame. Zesty and fresh, it only faintly hints of the variety's usual nuttiness.",,89,21.0,Burgenland,,,Anne Krebiehl MW,@AnneInVino,Tinhof 2016 Neuburger (Burgenland),Neuburger,Tinhof
60911,60911,South Africa,"Dusty dark cherry and blackberry fruit dominate the nose, with secondary aromas of game, peppery spice and tobacco. The dark fruit character continues on the palate, transitioning into the finish, which is laced with hints of mocha and spice. Medium weight, with nice vibrancy in the mouth. Drink now-2015.",Silkbush Mountain Vineyards,89,18.0,Breedekloof,,,Lauren Buzzeo,@laurbuzz,Lions Drift 2009 Silkbush Mountain Vineyards Pinotage (Breedekloof),Pinotage,Lions Drift
110087,110087,France,"This wine has a bitter edge to it, although attractive fruit lies underneath. It is juicy, packed with red fruits and acidity, although that surface bitterness is off-putting.",Léon,84,23.0,Burgundy,Coteaux Bourguignons,,Roger Voss,@vossroger,Jean-Luc and Paul Aegerter 2014 Léon  (Coteaux Bourguignons),Pinot Noir-Gamay,Jean-Luc and Paul Aegerter
106700,106700,Italy,"Aromas of beeswax, orchard fruit and a whiff of hazelnut lift out of the glass. Made without added sulfites, the bright round palate delivers mature yellow apple, white peach, lemon zest and a hint of white almond alongside fresh acidity. Its understated character will definitely appeal to lovers of reserved elegant whites.",1909,90,25.0,Lombardy,Lugana,,Kerin O’Keefe,@kerinokeefe,Ancilla 2016 1909  (Lugana),Turbiana,Ancilla
113806,113806,Austria,"Taking their cue from the old name for the local vineyards around Deutschkreutz in Mittelburgenland, the Reisners, who run the Igler winery, have fashioned a traditional style of Blaufränkisch. It's impressive, the density of the tannins never overwhelming the ripe, juicy, black fruit flavors. It is certainly a ripe wine, but the richness never overpowers the structure and the acidity.",Biiri Reserve,90,34.0,Mittelburgenland,,,Roger Voss,@vossroger,Hans Igler 2005 Biiri Reserve Blaufränkisch (Mittelburgenland),Blaufränkisch,Hans Igler
93767,93767,US,"Solidly in the Saxum style, which is to say a high alcohol (15.5%), massively flavored wine of enormous concentration and power. The blackberry, cherry, cassis and chocolate flavors have all kind of overtones, ranging from licorice and vanilla to gingerbread and candied violets. Saxum has become a cult favorite, one of the highest-priced brands from Paso Robles, and wines like this are the reason why. Drink now and through 2008. Syrah, Mourvèdre and Grenache.",James Berry Vineyard,95,55.0,California,Paso Robles,Central Coast,,,Saxum 2005 James Berry Vineyard Red (Paso Robles),Rhône-style Red Blend,Saxum
15348,15348,France,"As its 14.5% indicates, this is a particularly rich wine. Maybe too rich, because it is all superripe black fruit without the balance of structure or acidity. Enjoy it as a blockbuster, probably not with food.",Cuvée J.J. Lesgourges,84,17.0,Bordeaux,Bordeaux Supérieur,,Roger Voss,@vossroger,Château Cadillac 2009 Cuvée J.J. Lesgourges  (Bordeaux Supérieur),Bordeaux-style Red Blend,Château Cadillac
17660,17660,US,"Jean Hoefliger is the consulting winemaker for this wine, an earthy 100% expression of the variety that's rich and lush yet fully balanced in acidity. Dark truffle, forest floor and Bing cherry characterize the aromas and flavors, around a tightly wound core of intense fruit that explodes on the palate on the finish.",The Whitewing,92,55.0,California,Russian River Valley,Sonoma,Virginie Boone,@vboone,Armanino Family Cellars 2012 The Whitewing Pinot Noir (Russian River Valley),Pinot Noir,Armanino Family Cellars
21845,21845,Portugal,"A wine that is soft and fruity. The tannins are light, spiked with acidity and some bitter chocolate. The final character is fruity, rich and soft.",Terra Bella Reserve,86,,Port,,,Roger Voss,@vossroger,Fonseca NV Terra Bella Reserve  (Port),Port,Fonseca
4445,4445,Italy,"Easy, slender and fresh, this bright Chianti (85% Sangiovese with Merlot) reveals green notes of olive and herb followed by wild berry and spice.",,85,10.0,Tuscany,Chianti,,,,Straccali 2011  Chianti,Red Blend,Straccali
70092,70092,Chile,"Spicy, rubbery, subtle berry aromas come with a hard, smoky element. This is firm, tannic and grabby in feel, with heady flavors of baked berry, herbal notes and overt oak. The finish is smoky, sweet, woody and lightly green.",Quiron,89,30.0,Colchagua Valley,,,Michael Schachner,@wineschach,Viña La Ronciere 2011 Quiron Cabernet Sauvignon (Colchagua Valley),Cabernet Sauvignon,Viña La Ronciere
67925,67925,Austria,"Peppery notions of green pear, along with zesty lemon notes, add focus to this fresh, joyful and pliantly soft wine. Very easy to drink with its light body and subtle charm.",Stephanus,89,14.0,Kamptal,,,Anne Krebiehl MW,@AnneInVino,Weixelbaum 2015 Stephanus Grüner Veltliner (Kamptal),Grüner Veltliner,Weixelbaum
6153,6153,New Zealand,"A rather refined, restrained version of Marlborough Sauvignon, with slightly herbal overtones to the strone fruit and citrus flavors. It's round, with no rough edges, yet retains a clean, mouth-watering finish.",Pioneer Block #3 43 Degrees,89,23.0,Marlborough,,,Joe Czerwinski,@JoeCz,Saint Clair 2008 Pioneer Block #3 43 Degrees Sauvignon Blanc (Marlborough),Sauvignon Blanc,Saint Clair
82952,82952,Portugal,"Rich and soft, this is marked by a powerful black-fruit flavor rather than by strong tannins. There is nothing subtle in this hugely dense and concentrated offering. Ready to drink.",,87,,Alentejano,,,Roger Voss,@vossroger,Cortes de Cima 2010 Trincadeira (Alentejano),Trincadeira,Cortes de Cima
107478,107478,US,"Dark blackberry, blueberry and blackcurrant fruits make for a ripe but extremely enticing nose on this bottling, lifted by aromas of vanilla, cola, clove and anise. The palate is delicious and rich with black cherry, but a zesty, bright acidity and chalky tannins contribute depth and length, with a touch of dill.",Reserve,94,58.0,California,Paso Robles,Central Coast,Matt Kettmann,@mattkettmann,Brecon Estate 2014 Reserve Cabernet Sauvignon (Paso Robles),Cabernet Sauvignon,Brecon Estate
66377,66377,Italy,"Year in and year out this estate leads the way with so-called Baby Brunello. And this version may be one of the best yet. A pure-fruit nose sets things up and the palate, redolent with fresh raspberry, leather and spice, doesn't disappoint. It's both deep and light, medium-bodied but still pretty full.",,90,19.0,Tuscany,Rosso di Montalcino,,Michael Schachner,@wineschach,Il Poggione 1999  Rosso di Montalcino,Sangiovese,Il Poggione
95393,95393,US,"Soft and approachable, this Petite Sirah has easy tannins and rich blackberry, funky meat, cola and cedar flavors. Ready now.",,86,30.0,California,Rockpile,Sonoma,,,Miro 2008 Petite Sirah (Rockpile),Petite Sirah,Miro
6606,6606,Italy,"Luminous and bright, this beautiful Vernaccia offers pretty tones of honey, peach, pear and cherry blossoms. There's a sweet element to the nose that creates an interesting contrast with the wine's natural acidity.",Vigna Aprico,86,12.0,Tuscany,Vernaccia di San Gimignano,,,,Le Solive 2007 Vigna Aprico  (Vernaccia di San Gimignano),Vernaccia,Le Solive
35225,35225,Chile,"Neutral smelling, with mild apple and briney aromas. Feels heavy, flat and on the thick side, with average flavors of melon but little to no citrus or smack. Melony, soft and bitter on the finish.",Crucero,83,10.0,Curicó Valley,,,Michael Schachner,@wineschach,Siegel 2011 Crucero Sauvignon Blanc (Curicó Valley),Sauvignon Blanc,Siegel
117763,117763,US,"This is high in alcohol, but the result is a rich Pinot Blanc, with citrus, tropical fruit, mineral, white flower and honey flavors. The bright, citrusy acidity keeps the mouthfeel keen and zingy.",Bien Nacido Vineyard,91,24.0,California,Santa Maria Valley,Central Coast,,,Nagy 2011 Bien Nacido Vineyard Pinot Blanc (Santa Maria Valley),Pinot Blanc,Nagy
86465,86465,France,"Aromatic but tart notes of kumquat signal concentration and citric poise. The palate is rich with zesty, aromatic notes of tangerine zest. This is concentrated and dry, explosive and aromatic—a bundle of citrus energy, with swirling clouds of kumquat and tangerine.",Schoenenbourg Grand Cru,93,40.0,Alsace,Alsace,,Anne Krebiehl MW,@AnneInVino,Domaine Bott-Geyl 2013 Schoenenbourg Grand Cru Riesling (Alsace),Riesling,Domaine Bott-Geyl
105166,105166,US,"Aromas of pear, lees and tropical fruit lead to a rich flavorful palate, absolutely loaded with tropical-fruit flavors that show a delightful sense of balance. The oak usage (25% new French) is judicious, allowing the fruit to shine.",Ysabella Bjork,92,45.0,Washington,Columbia Valley (WA),Columbia Valley,Sean P. Sullivan,@wawinereport,Morell-Peña 2015 Ysabella Bjork Chardonnay (Columbia Valley (WA)),Chardonnay,Morell-Peña
57106,57106,Austria,"Lime zest, the freshly peeled skin of Conference pears and crushed watercress make for an intensely fresh trio of flavors. This is zesty and concentrated, sleek and refreshing on a linear, slender but concentrated palate.",Süssenberg Federspiel,90,22.0,Wachau,,,Anne Krebiehl MW,@AnneInVino,Eder 2015 Süssenberg Federspiel Grüner Veltliner (Wachau),Grüner Veltliner,Eder
74870,74870,Argentina,"Rubbery, jammy, unfocused berry aromas are blurry. This feels heavy and low on pulse. Flavors of stewed plum and berry fruits end with a mild, weedy, green note.",,82,14.0,Mendoza Province,Mendoza,,Michael Schachner,@wineschach,Tercos 2014 Malbec (Mendoza),Malbec,Tercos
39218,39218,US,"Exuberant rose, lychee and orange blossom perfume abounds on the nose of this light-bodied white blend. Just a shade off dry on the palate, its sun-kissed peach and citrus flavors are plush and concentrated. Zesty acidity and a crush of minerals revitalize the finish.",Summer in a Bottle,89,24.0,New York,Long Island,Long Island,Anna Lee C. Iijima,,Wölffer 2016 Summer in a Bottle White (Long Island),White Blend,Wölffer
61757,61757,Portugal,"This is a classic style of Bairrada sparkling wine—a blend of Bical, Maria Gomes and Arinto. Plenty of crisp acidity and soft white fruit flavors balance its yeasty character. Drink now.",Encontro Q do E Blanco Bruto Classico,85,8.0,Bairrada,,,Roger Voss,@vossroger,Global Wines NV Encontro Q do E Blanco Bruto Classico Sparkling (Bairrada),Portuguese Sparkling,Global Wines
103601,103601,Austria,"This comes across as so light, friendly and easy to drink that one almost forgets to note the outstanding purity of fruit. Fresh cherries and blueberries present themselves honestly. Silky tannins and a spicy aftertaste suggest that it took top-quality fruit and lots of experience to make something so deceptively simple.",Novemberlese,91,18.0,Niederösterreich,,,Anne Krebiehl MW,@AnneInVino,Steininger 2012 Novemberlese Zweigelt (Niederösterreich),Zweigelt,Steininger
23220,23220,Italy,"Earthy aromas that recall leather, truffle, ripe plum, blue flower and exotic spice take shape in the glass. The full-bodied palate shows dried black cherry, blackberry jam, sage and clove alongside close-grained tannins that leave a grippy finish.",Varco 84,90,48.0,Tuscany,Brunello di Montalcino,,Kerin O’Keefe,@kerinokeefe,Molino di Sant'Antimo 2011 Varco 84  (Brunello di Montalcino),Sangiovese,Molino di Sant'Antimo
79253,79253,France,"Soft, ripe and fruity, this lightly spicy wine is full of red fruits and crisp acidity. It balances between the fruit and the tangy, textured aftertaste. Drink now.",,86,15.0,Bordeaux,Bordeaux Rosé,,Roger Voss,@vossroger,Château Tassin 2016 Rosé (Bordeaux Rosé),Rosé,Château Tassin
14557,14557,Spain,"This red-fruit-dominated Garnacha smells of earthy cherry and plum along with orange peel. A racy, chewy, slightly rough palate of pie cherry, red plum, raisin and chocolate finish juicy and aggressive.",Varietales,89,20.0,Northern Spain,Rioja,,Michael Schachner,@wineschach,Baron De Ley 2012 Varietales  (Rioja),Garnacha,Baron De Ley
20109,20109,France,"Notes of freshly peeled red apples are inviting and continue on the soft, rounded and generous palate. It has a lovely midpalate mouthfeel and drinks just off dry, with an accent of vanilla and the merest touch of cinnamon.",Tradition,88,17.0,Alsace,Alsace,,Anne Krebiehl MW,@AnneInVino,W. Gisselbrecht 2015 Tradition Pinot Gris (Alsace),Pinot Gris,W. Gisselbrecht
16312,16312,Australia,"Full bodied, creamy and lush, this is a prototypical Barossa Valley Shiraz from a longtime master of the variety. Smoke, cedar, mulberry and eucalyptus notes mingle easily on the nose, while savory notes of roasted meat and dried herb blend seamlessly into the fruit, ending long, velvety and rich.",Eligo,94,100.0,South Australia,Barossa Valley,,Joe Czerwinski,@JoeCz,John Duval Wines 2013 Eligo Shiraz (Barossa Valley),Shiraz,John Duval Wines
45159,45159,US,"Somewhat sharp in acids and tannins, with a streak of green mint that weakens the blackberry and cherry flavors. Good structure, but a bit unripe and unbalanced, and not likely to age.",Felicity,85,40.0,California,Napa Valley,Napa,,,Sodaro 2005 Felicity Cabernet Sauvignon (Napa Valley),Cabernet Sauvignon,Sodaro
34070,34070,Italy,"Aromas of black plum and fragrant blue flowers waft out of the glass. On the bright, easygoing palate, notes of mint and white pepper add interest to the black cherry core. Fresh acidity and supple tannins back up the juicy flavors.",,88,25.0,Tuscany,Chianti Rufina,,Kerin O’Keefe,@kerinokeefe,Dreolino 2013  Chianti Rufina,Red Blend,Dreolino
75616,75616,France,"94-96 Barrel sample. Lots of new wood here, maybe too dominant. But it is a stage, because the fruit weight is also there to give a wine of considerable complexity, dry and solid.",Barrel sample,95,,Bordeaux,Saint-Julien,,Roger Voss,@vossroger,Château Langoa Barton 2009 Barrel sample  (Saint-Julien),Bordeaux-style Red Blend,Château Langoa Barton
101103,101103,Italy,"This Moscato Passito from northern Italy opens with crisp and pristine aromas of yellow rose, honey, stone fruit and white almond. On the close, the wine is sticky, sweet and succulent. Pair it with vanilla cream or panna cotta with caramel.",San Giovanni,92,,Piedmont,Piedmont,,,,Tenuta Olim Bauda 2003 San Giovanni Moscato (Piedmont),Moscato,Tenuta Olim Bauda
81474,81474,US,"The vineyard lies in the Van Duzer corridor, and the regular winds thicken the grape skins, giving chewy, astringent tannins. Tart plum and wild-cherry fruit flavors carry a peppery bite. The wine was aged for nine months in a neutral barrel of Oregon oak.",Havlin Vineyard,89,35.0,Oregon,Willamette Valley,Willamette Valley,Paul Gregutt,@paulgwine ,Martin Woods 2016 Havlin Vineyard Gamay (Willamette Valley),Gamay,Martin Woods
128454,128454,Italy,"Dark and concentrated in appearance, this hearty Aglianico opens with tones of spice and smoked bacon backed by black fruit, tobacco and dark leather. The overall package is very enticing and that wine is softer and smoother than most other expressions of this firmly tannic grape.",,88,22.0,Southern Italy,Irpinia,,,,Donnachiara 2007 Aglianico (Irpinia),Aglianico,Donnachiara
82699,82699,Australia,"Probably because of its youth, this wine comes out of the chute a little tight and rubbery; try giving it a quick decanting, or swirl it aggressively in the glass to bring out the underlying cola and blackberry aromas and flavors. Turns slightly dusty on the finish, suggesting at least a few years' worth of drinkability.",d'Arrys Original,88,19.0,South Australia,McLaren Vale,,Joe Czerwinski,@JoeCz,D'Arenberg 2008 d'Arrys Original Shiraz-Grenache (McLaren Vale),Shiraz-Grenache,D'Arenberg
42426,42426,Italy,"Aromas of mature dark-skinned fruit, underbrush and tobacco lead the nose on this full-bodied wine. The ripe, dense palate offers black cherry, cassis, clove and dried hay alongside round tannins.",,88,20.0,Tuscany,Monteregio di Massa Marittima,,Kerin O’Keefe,@kerinokeefe,Morisfarms 2011  Monteregio di Massa Marittima,Red Blend,Morisfarms
123435,123435,US,"This young, grapy wine has buoyant flavors of raspberry jam. It needs more time, but the fruit is excellent; the finish just a little warm.",,87,25.0,Washington,Red Mountain,Columbia Valley,Paul Gregutt,@paulgwine ,Eight Bells 2009 Cabernet Sauvignon (Red Mountain),Cabernet Sauvignon,Eight Bells
68934,68934,France,"A wine that offers many personalities, from serious complexity to broad, smiling, ripe fruits. Pineapple, peaches, almonds and acidity come together in a texture that is still integrating. Give the wine another two years at least.",Domaine du Pavillon Clos des Mouches Premier Cru,92,,Burgundy,Beaune,,Roger Voss,@vossroger,Albert Bichot 2007 Domaine du Pavillon Clos des Mouches Premier Cru  (Beaune),Chardonnay,Albert Bichot
5541,5541,Spain,"Wheaty and waxy on the nose, this Viura also smells of vinyl and corn. A limited palate is directed by pointed acidity, while flavors of almond skins and pithy citrus are somewhat bitter and finish with zero character.",Puerta Vieja Blanco,82,9.0,Northern Spain,Rioja,,Michael Schachner,@wineschach,Bodegas Riojanas 2013 Puerta Vieja Blanco Viura (Rioja),Viura,Bodegas Riojanas
124616,124616,Chile,"Tarry black-cherry aromas are a bit damp, oaky and scratchy, but overall this opens well. A solid, firm, edgy palate offers flavors of herbal blackberry and baked black plum, while the finish is meaty and a touch salty.",Select Terroir,86,10.0,Cachapoal Valley,,,Michael Schachner,@wineschach,Santa Ema 2014 Select Terroir Merlot (Cachapoal Valley),Merlot,Santa Ema
113115,113115,US,"This well-crafted red wine is supple and smooth. It opens with scents of violets and berries, fills in with round, lush berry and cherry fruit flavors, then applies a wash of milk chocolate to the tannins.",Red Mountain Red,88,50.0,Washington,Red Mountain,Columbia Valley,Paul Gregutt,@paulgwine ,Hightower 2005 Red Mountain Red Red (Red Mountain),Red Blend,Hightower
99247,99247,US,"Temptingly ripe aromas and flavors make this a very generous wine. It also has some complexity due to a slight earthy, savory accent in the aroma that returns on the finish. Medium to full bodied, it will pair well with robust, meaty dishes and will be perfect for sipping after a meal.",Lot 464,88,13.0,California,Lodi,Central Valley,Jim Gordon,@gordone_cellars,Cameron Hughes 2012 Lot 464 Zinfandel (Lodi),Zinfandel,Cameron Hughes
82173,82173,Austria,"A rather subdued nose leads to a rounded palate flavored by savory yeast, subtle pepper and thyme. A wine with this sort of textured mouth-feel simply cries out for food. Its zingy freshness will cut through any richness while its subtle aromatics of red apple and herb will complement but not overpower flavors. This indigenous Austrian original will do justice to just about any kind of European cuisine.",,90,20.0,Thermenregion,,,Anne Krebiehl MW,@AnneInVino,Johanneshof Reinisch 2014 Rotgipfler (Thermenregion),Rotgipfler,Johanneshof Reinisch
